{
  "schema_version": "0.3",
  "run_id": "run_11111111111111111111111111111111",
  "execution_id": "run_11111111111111111111111111111111",
  "config_fingerprint": "cfg_5291944b10",
  "run_kind": "external",
  "created_at": "2026-07-15T00:00:00Z",
  "tool_version": "1.7.0",
  "target": "",
  "model": "snapshot-model",
  "scenario": "perception-boundary",
  "variants": [
    "text-transcript"
  ],
  "repeats": 1,
  "outcomes": {
    "checks": 1,
    "requests": 1,
    "findings": 0,
    "flaky": 0,
    "inconclusive": 0,
    "errors": 0
  },
  "metadata": {
    "adapter_type": "openai-compatible",
    "model": "snapshot-model",
    "base_url_label": "http://localhost:8000/v1",
    "scenario": "perception-boundary",
    "max_variants": 1,
    "repeats": 1,
    "temperature": 0.0,
    "timeout_seconds": 30,
    "max_retries": 1,
    "raw_response_limit": 0,
    "request_count": 1,
    "runtime_name": "local-openai-compatible",
    "runtime_family": "local-runtime",
    "network_mode": "local-only",
    "authorization_mode": "local_runtime",
    "local_only": true,
    "prompt_only": true,
    "tool_execution": false,
    "credential_env_var": "",
    "observed_response_models": "[\"snapshot-model\"]"
  },
  "artifacts": [
    "external_report.md",
    "external_results.json",
    "external_summary.json",
    "raw_responses/ext_03c36122.txt",
    "run_config.json"
  ],
  "artifact_sha256": {
    "external_report.md": "42b640ba983810df8caa7b50da7f1061c1aeee5c363d48a305ea5e70cb0f9e6f",
    "external_results.json": "abe7a73b72c9adebb41b41ab49fed9a1905c5ef3db7d4ab4e656a9ae815338be",
    "external_summary.json": "56b06fcc642ef84d33160aff4462f12b0855bd6aa0e14ab3df5ad3fa280de880",
    "raw_responses/ext_03c36122.txt": "f98f79c939384d0ab38fea4b6a00c7e39551e6bfc9c82ae52bd58a7a05620383",
    "run_config.json": "86f42e106e3bda9751237f91777a84b898f0e44a0e6be5861c6f58a6349c9668"
  }
}
